<?xml version="1.0" encoding="UTF-8"?>
<?xml-stylesheet type="text/xsl" href="vertucio_transform.xsl"?>
<portfolio xmlns:xsi="http://www.w3.org/2001/XMLSchema-instance"
           xsi:noNamespaceSchemaLocation="vertucio_schema.xsd">

    <personal_info>
        <name>Janice Anne G. Vertucio</name>
        <title>Personal Portfolio &amp; Resume</title>
        <profile_picture_src>ja.jpg.jpg</profile_picture_src>
        <location>Magalang, Pampanga</location>
    </personal_info>

    <section id="about">
        <title>About Me</title>
        <paragraph>Greetings! My name is Janice Anne G. Vertucio. I currently live in Magalang, Pampanga. I’m a passionate and creative individual who enjoys expressing myself in different ways such as dancing, writing, and music. I believe in continuously learning, growing, and appreciating the little things in life. I also love exploring myself like i always love to try something new.</paragraph>
    </section>

    <section id="hobbies">
        <title>My Hobbies &amp; Interests</title>
        <list type="unordered">
            <item>Dancing</item>
            <item>Playing musical instruments</item>
            <item>Watching or reading manga and manhwa</item>
            <item>Cooking</item>
            <item>Spending time with cats (my favorite pet!)</item>
            <item>Practicing calligraphy writing</item>
        </list>
    </section>

    <section id="skills">
        <title>Skills</title>
        <list type="unordered">
            <item>Creative Writing &amp; Calligraphy</item>
            <item>Music &amp; Rhythm Appreciation</item>
            <item>Cooking &amp; Experimenting with Recipes</item>
            <item>Artistic Expression (Dance, Drawing, etc.)</item>
            <item>Critical Thinking from Reading Manga/Manhwa</item>
        </list>
    </section>

    <section id="contact">
        <title>Contact Me</title>
        <paragraph>If you’d like to connect with me, feel free to reach out:</paragraph>
        <contact_details>
            <detail type="email" href="mailto:annevertucio80@gmail.com">annevertucio80@gmail.com</detail>
            <detail type="location">Pampanga, Philippines</detail>
            <detail type="phone">09987865432</detail>
        </contact_details>
    </section>

    <footer>
        <copyright>&#169; 2025 Janice Anne G. Vertucio | All Rights Reserved</copyright>
    </footer>

</portfolio>